{
  "$schema": "../../schemas/natui-app.schema.json",
  "schemaVersion": 1,
  "id": "dev.natui.demo",
  "name": "NatUI Demo",
  "version": "0.2.1",
  "buildNumber": "1",
  "entry": "src/main.tsx",
  "executable": "NatUIDemo",
  "output": "dist/package",
  "icons": {
    "macos": ".natui/icons/AppIcon.icns",
    "windows": ".natui/icons/AppIcon.ico"
  }
}
